{
  "$schema": "https://raw.githubusercontent.com/opena2a-standards/atx-conformance/main/schemas/fixture-v1.schema.json",
  "name": "atx-v1_1/cross-issuer-key",
  "description": "An ATX v1.1 credential issued by the primary authority but signed by a different trusted authority's key (partner.example). The secondary authority is trusted and its key is configured, and the signature is valid over JCS(TBS), but the secondary is neither the issuer nor present in the signed issuerChain. A spec-conformant verifier binds each signature to a key controlled by the issuer, or by an authority that is both named in the signed issuerChain and in the verifier's trusted issuers, and MUST REJECT with a signature-validation reason.",
  "requirement": "§1.3 step 4, key eligibility: under atcVersion 1.1 a key is eligible only for the issuerDid or a trusted issuer the signed issuerChain names, so a signature made with a trusted authority's key outside both is a signature failure",
  "spec": [
    {
      "id": "ATX",
      "ref": "https://github.com/opena2a-standards/atx-spec/blob/e89bed94ca0a7308e2d6915e384be4c89d3a67df/core.md",
      "section": "1.1 ATX schema"
    },
    {
      "id": "ATX",
      "ref": "https://github.com/opena2a-standards/atx-spec/blob/e89bed94ca0a7308e2d6915e384be4c89d3a67df/core.md",
      "section": "1.3 Local verification algorithm"
    },
    {
      "id": "ATX",
      "ref": "https://github.com/opena2a-standards/atx-spec/blob/e89bed94ca0a7308e2d6915e384be4c89d3a67df/core.md",
      "section": "1.3a.2 JCS form (`atcVersion` = \"1.1\")"
    },
    {
      "id": "AIP",
      "ref": "https://github.com/opena2a-org/agent-identity-protocol/blob/main/AIP-SPEC.md",
      "section": "§3 Hybrid Ed25519 + ML-DSA-65 signing, §6.1 9-factor trust scoring"
    },
    {
      "id": "RFC 8032",
      "ref": "https://datatracker.ietf.org/doc/html/rfc8032",
      "section": "§7.1 Test 1 (Ed25519 keypair source for issuer-primary)"
    }
  ],
  "keypairRefs": [
    {
      "role": "issuer-primary",
      "path": "vectors/issuer-primary.json",
      "algorithm": "Ed25519",
      "publicKeyHex": "d75a980182b10ab7d54bfed3c964073a0ee172f3daa62325af021a68f707511a",
      "keyId": "did:opena2a:authority:opena2a.org#key-1"
    },
    {
      "role": "issuer-secondary",
      "path": "vectors/issuer-secondary.json",
      "algorithm": "Ed25519",
      "publicKeyHex": "2043fa51c3d9e4a21a535ccb38bdc4fb56083737d22059d69475e7e43c47f582",
      "keyId": "did:opena2a:authority:partner.example#key-1"
    }
  ],
  "verifierState": {
    "clockRfc3339": "2026-05-24T00:00:00Z",
    "trustedIssuers": [
      "did:opena2a:authority:opena2a.org",
      "did:opena2a:authority:partner.example"
    ],
    "publicKeys": [
      {
        "role": "issuer-primary",
        "path": "vectors/issuer-primary.json",
        "algorithm": "Ed25519",
        "publicKeyHex": "d75a980182b10ab7d54bfed3c964073a0ee172f3daa62325af021a68f707511a",
        "keyId": "did:opena2a:authority:opena2a.org#key-1"
      },
      {
        "role": "issuer-cosigner-1",
        "path": "vectors/issuer-cosigner-1.json",
        "algorithm": "Ed25519",
        "publicKeyHex": "3d4017c3e843895a92b70aa74d1b7ebc9c982ccf2ec4968cc0cd55f12af4660c",
        "keyId": "did:opena2a:authority:opena2a.org#key-2"
      },
      {
        "role": "issuer-cosigner-2",
        "path": "vectors/issuer-cosigner-2.json",
        "algorithm": "Ed25519",
        "publicKeyHex": "fc51cd8e6218a1a38da47ed00230f0580816ed13ba3303ac5deb911548908025",
        "keyId": "did:opena2a:authority:opena2a.org#key-3"
      },
      {
        "role": "issuer-secondary",
        "path": "vectors/issuer-secondary.json",
        "algorithm": "Ed25519",
        "publicKeyHex": "2043fa51c3d9e4a21a535ccb38bdc4fb56083737d22059d69475e7e43c47f582",
        "keyId": "did:opena2a:authority:partner.example#key-1"
      }
    ]
  },
  "expected": {
    "verifyResult": "REJECT",
    "rejectCategory": "SIGNATURE_INVALID",
    "reasonContains": "signature"
  },
  "atx": {
    "id": "00000000-0000-0000-0000-000000000001",
    "atcVersion": "1.1",
    "agentId": "agent_conformance_test_001",
    "agentDid": "did:opena2a:agent:agent_conformance_test_001",
    "publisher": "opena2a-conformance",
    "publisherDid": "did:opena2a:publisher:opena2a-conformance",
    "version": "1.0.0",
    "contentHash": "0000111122223333444455556666777788889999aaaabbbbccccddddeeeeffff",
    "buildAttestation": "https://slsa.dev/provenance/v1#opena2a-conformance",
    "transparencyLogIndex": 42,
    "capabilities": [
      "db:read",
      "db:write"
    ],
    "behavioralProfile": {
      "checksum": "sha256:ghi789",
      "generatedAt": "2026-05-19T00:00:00Z",
      "observationDays": 14
    },
    "scanSummary": {
      "hma": "passed",
      "criticalFindings": 0,
      "highFindings": 0,
      "secretless": "clean",
      "cryptoServe": "no-weak-crypto",
      "oasbLevel": "L1"
    },
    "trustScore": 87.5,
    "trustLevel": 4,
    "issuedAt": "2026-05-23T00:00:00Z",
    "expiresAt": "2099-12-31T23:59:59Z",
    "issuerDid": "did:opena2a:authority:opena2a.org",
    "issuerChain": [
      "did:opena2a:authority:opena2a.org-root",
      "did:opena2a:authority:opena2a.org"
    ],
    "signatures": [
      {
        "keyId": "did:opena2a:authority:partner.example#key-1",
        "algorithm": "Ed25519",
        "value": "50G32IpNdS/KwuOH8SJmLK24j8kvqUkX0hWXYYUp3QXMyAYy5XRQkBYe2oUlHxKpqw7+Z+LSA79vChQ/oHUaDA=="
      }
    ],
    "revoked": false,
    "createdAt": "2026-05-23T00:00:00Z"
  }
}
