{
  "$schema": "https://raw.githubusercontent.com/opena2a-standards/atx-conformance/main/schemas/fixture-v1.schema.json",
  "name": "atx-v1_1/dotless-i-member",
  "description": "An ATX v1.1 credential whose Ed25519 signature verifies, carrying one member its issuer did not write: a member named U+0131 (LATIN SMALL LETTER DOTLESS I) followed by ssuedAt, holding 2099-01-01T00:00:00Z, written directly after its signed issuedAt member once the credential is signed. JCS(TBS) holds no member the credential does not specify, so the signature does not cover it. Java 25's String.equalsIgnoreCase compares that name equal to issuedAt, so a relying party that binds the credential's JSON again by such a comparison, keeping the last of the members it joins, reads an issuedAt of 2099-01-01T00:00:00Z, where the signature covers 2026-05-23T00:00:00Z. Verifiers MUST reject a member name outside printable ASCII (U+0020 to U+007E) in an object they decode (the credential, a signature entry, scanSummary or behavioralProfile) as PARSE_ERROR before interpreting any field, a rule that needs no case table. A verifier that folds names by ASCII case, or by a table that keeps U+0131 apart from i, wrongly ACCEPTs.",
  "requirement": "§1.3 step 1: parsing the credential rejects a member name outside printable ASCII in an object the verifier decodes (U+0131 followed by ssuedAt, beside issuedAt) as PARSE_ERROR before any field is read (§12)",
  "spec": [
    {
      "id": "ATX",
      "ref": "https://github.com/opena2a-standards/atx-spec/blob/e89bed94ca0a7308e2d6915e384be4c89d3a67df/core.md",
      "section": "1.1 ATX schema"
    },
    {
      "id": "ATX",
      "ref": "https://github.com/opena2a-standards/atx-spec/blob/e89bed94ca0a7308e2d6915e384be4c89d3a67df/core.md",
      "section": "1.3 Local verification algorithm"
    },
    {
      "id": "ATX",
      "ref": "https://github.com/opena2a-standards/atx-spec/blob/e89bed94ca0a7308e2d6915e384be4c89d3a67df/core.md",
      "section": "1.3a.2 JCS form (`atcVersion` = \"1.1\")"
    },
    {
      "id": "AIP",
      "ref": "https://github.com/opena2a-standards/agent-identity-protocol/blob/80db7b2304b2f37bddf1c82e788c27e1ab874b3d/AIP-SPEC.md",
      "section": "§3.1 Cryptographic Identity (Ed25519 signing)"
    },
    {
      "id": "AIP",
      "ref": "https://github.com/opena2a-standards/agent-identity-protocol/blob/80db7b2304b2f37bddf1c82e788c27e1ab874b3d/AIP-SPEC.md",
      "section": "§6.1 Multi-Factor Algorithm"
    },
    {
      "id": "RFC 8032",
      "ref": "https://datatracker.ietf.org/doc/html/rfc8032",
      "section": "§7.1 Test 1 (Ed25519 keypair source for issuer-primary)"
    }
  ],
  "keypairRefs": [
    {
      "role": "issuer-primary",
      "path": "vectors/issuer-primary.json",
      "algorithm": "Ed25519",
      "publicKeyHex": "d75a980182b10ab7d54bfed3c964073a0ee172f3daa62325af021a68f707511a",
      "keyId": "did:opena2a:authority:opena2a.org#key-1"
    }
  ],
  "verifierState": {
    "clockRfc3339": "2026-05-24T00:00:00Z",
    "trustedIssuers": [
      "did:opena2a:authority:opena2a.org"
    ],
    "publicKeys": [
      {
        "role": "issuer-primary",
        "path": "vectors/issuer-primary.json",
        "algorithm": "Ed25519",
        "publicKeyHex": "d75a980182b10ab7d54bfed3c964073a0ee172f3daa62325af021a68f707511a",
        "keyId": "did:opena2a:authority:opena2a.org#key-1"
      },
      {
        "role": "issuer-cosigner-1",
        "path": "vectors/issuer-cosigner-1.json",
        "algorithm": "Ed25519",
        "publicKeyHex": "3d4017c3e843895a92b70aa74d1b7ebc9c982ccf2ec4968cc0cd55f12af4660c",
        "keyId": "did:opena2a:authority:opena2a.org#key-2"
      },
      {
        "role": "issuer-cosigner-2",
        "path": "vectors/issuer-cosigner-2.json",
        "algorithm": "Ed25519",
        "publicKeyHex": "fc51cd8e6218a1a38da47ed00230f0580816ed13ba3303ac5deb911548908025",
        "keyId": "did:opena2a:authority:opena2a.org#key-3"
      }
    ]
  },
  "expected": {
    "verifyResult": "REJECT",
    "rejectCategory": "PARSE_ERROR",
    "reasonContains": "printable ASCII"
  },
  "atx": {
    "id": "00000000-0000-0000-0000-000000000001",
    "atcVersion": "1.1",
    "agentId": "agent_conformance_test_001",
    "agentDid": "did:opena2a:agent:agent_conformance_test_001",
    "publisher": "opena2a-conformance",
    "publisherDid": "did:opena2a:publisher:opena2a-conformance",
    "version": "1.0.0",
    "contentHash": "0000111122223333444455556666777788889999aaaabbbbccccddddeeeeffff",
    "buildAttestation": "https://slsa.dev/provenance/v1#opena2a-conformance",
    "transparencyLogIndex": 42,
    "capabilities": [
      "db:read",
      "db:write"
    ],
    "behavioralProfile": {
      "checksum": "sha256:ghi789",
      "generatedAt": "2026-05-19T00:00:00Z",
      "observationDays": 14
    },
    "scanSummary": {
      "hma": "passed",
      "criticalFindings": 0,
      "highFindings": 0,
      "secretless": "clean",
      "cryptoServe": "no-weak-crypto",
      "oasbLevel": "L1"
    },
    "trustScore": 87.5,
    "trustLevel": 4,
    "issuedAt": "2026-05-23T00:00:00Z",
    "ıssuedAt": "2099-01-01T00:00:00Z",
    "expiresAt": "2099-12-31T23:59:59Z",
    "issuerDid": "did:opena2a:authority:opena2a.org",
    "issuerChain": [
      "did:opena2a:authority:opena2a.org-root",
      "did:opena2a:authority:opena2a.org"
    ],
    "signatures": [
      {
        "keyId": "did:opena2a:authority:opena2a.org#key-1",
        "algorithm": "Ed25519",
        "value": "avfPHRdMUb4tBMWoOJpATKnvsI+aSDkcGWpEznE6D9s19YIDG2jjV/aURzoBsNKphxhdlxu93bMer+TF1y26Cw=="
      }
    ],
    "revoked": false,
    "createdAt": "2026-05-23T00:00:00Z"
  }
}
