{
  "$schema": "https://raw.githubusercontent.com/opena2a-standards/atx-conformance/main/schemas/fixture-v1.schema.json",
  "name": "atx-v1/revoked-crl-only",
  "description": "An ATX v1.0 credential whose own revoked flag is false and whose AgentID appears in the verifier's CRL. It is the accepted baseline in every other respect: a trusted issuer, unexpired, one Ed25519 signature that verifies. CRL membership is the only thing that revokes it, so a verifier that reads the credential's revoked flag and never consults the CRL wrongly accepts. The flag is outside the signed bytes of both signing forms, so it can be cleared on a revoked credential without breaking the signature; the CRL entry cannot. Verifier MUST REJECT with a revocation reason that names the CRL.",
  "requirement": "§1.3 step 6: an agentId listed on the verifier's CRL is rejected although the credential's own revoked flag is false",
  "spec": [
    {
      "id": "ATX",
      "ref": "https://github.com/opena2a-standards/atx-spec/blob/e89bed94ca0a7308e2d6915e384be4c89d3a67df/core.md",
      "section": "1.1 ATX schema"
    },
    {
      "id": "ATX",
      "ref": "https://github.com/opena2a-standards/atx-spec/blob/e89bed94ca0a7308e2d6915e384be4c89d3a67df/core.md",
      "section": "1.3 Local verification algorithm"
    },
    {
      "id": "ATX",
      "ref": "https://github.com/opena2a-standards/atx-spec/blob/e89bed94ca0a7308e2d6915e384be4c89d3a67df/core.md",
      "section": "1.3a.1 Legacy form (`atcVersion` = \"1.0\")"
    },
    {
      "id": "ATX",
      "ref": "https://github.com/opena2a-standards/atx-spec/blob/e89bed94ca0a7308e2d6915e384be4c89d3a67df/core.md",
      "section": "3.3 Revocation flow"
    },
    {
      "id": "AIP",
      "ref": "https://github.com/opena2a-org/agent-identity-protocol/blob/main/AIP-SPEC.md",
      "section": "§3 Hybrid Ed25519 + ML-DSA-65 signing, §6.1 9-factor trust scoring"
    },
    {
      "id": "RFC 8032",
      "ref": "https://datatracker.ietf.org/doc/html/rfc8032",
      "section": "§7.1 Test 1 (Ed25519 keypair source for issuer-primary)"
    }
  ],
  "keypairRefs": [
    {
      "role": "issuer-primary",
      "path": "vectors/issuer-primary.json",
      "algorithm": "Ed25519",
      "publicKeyHex": "d75a980182b10ab7d54bfed3c964073a0ee172f3daa62325af021a68f707511a",
      "keyId": "did:opena2a:authority:opena2a.org#key-1"
    }
  ],
  "verifierState": {
    "clockRfc3339": "2026-05-24T00:00:00Z",
    "trustedIssuers": [
      "did:opena2a:authority:opena2a.org"
    ],
    "publicKeys": [
      {
        "role": "issuer-primary",
        "path": "vectors/issuer-primary.json",
        "algorithm": "Ed25519",
        "publicKeyHex": "d75a980182b10ab7d54bfed3c964073a0ee172f3daa62325af021a68f707511a",
        "keyId": "did:opena2a:authority:opena2a.org#key-1"
      },
      {
        "role": "issuer-cosigner-1",
        "path": "vectors/issuer-cosigner-1.json",
        "algorithm": "Ed25519",
        "publicKeyHex": "3d4017c3e843895a92b70aa74d1b7ebc9c982ccf2ec4968cc0cd55f12af4660c",
        "keyId": "did:opena2a:authority:opena2a.org#key-2"
      },
      {
        "role": "issuer-cosigner-2",
        "path": "vectors/issuer-cosigner-2.json",
        "algorithm": "Ed25519",
        "publicKeyHex": "fc51cd8e6218a1a38da47ed00230f0580816ed13ba3303ac5deb911548908025",
        "keyId": "did:opena2a:authority:opena2a.org#key-3"
      }
    ],
    "crl": {
      "version": 1,
      "issuedAt": "2026-05-23T12:00:00Z",
      "nextUpdate": "2026-05-30T12:00:00Z",
      "entries": [
        {
          "agentId": "agent_conformance_test_001",
          "revokedAt": "2026-05-23T12:00:00Z",
          "reason": "key compromise (test)"
        }
      ],
      "signature": "TEST_ONLY_UNSIGNED_CRL"
    }
  },
  "expected": {
    "verifyResult": "REJECT",
    "rejectCategory": "REVOKED",
    "reasonContains": "CRL"
  },
  "atx": {
    "id": "00000000-0000-0000-0000-000000000001",
    "atcVersion": "1.0",
    "agentId": "agent_conformance_test_001",
    "agentDid": "did:opena2a:agent:agent_conformance_test_001",
    "publisher": "opena2a-conformance",
    "publisherDid": "did:opena2a:publisher:opena2a-conformance",
    "version": "1.0.0",
    "contentHash": "0000111122223333444455556666777788889999aaaabbbbccccddddeeeeffff",
    "buildAttestation": "https://slsa.dev/provenance/v1#opena2a-conformance",
    "transparencyLogIndex": 42,
    "capabilities": [
      "db:read",
      "db:write"
    ],
    "scanSummary": {
      "hma": "passed",
      "criticalFindings": 0,
      "highFindings": 0,
      "secretless": "clean",
      "cryptoServe": "no-weak-crypto",
      "oasbLevel": "L1"
    },
    "trustScore": 87.5,
    "trustLevel": 4,
    "issuedAt": "2026-05-23T00:00:00Z",
    "expiresAt": "2099-12-31T23:59:59Z",
    "issuerDid": "did:opena2a:authority:opena2a.org",
    "issuerChain": [
      "did:opena2a:authority:opena2a.org",
      "did:opena2a:authority:opena2a.org-root"
    ],
    "signatures": [
      {
        "keyId": "did:opena2a:authority:opena2a.org#key-1",
        "algorithm": "Ed25519",
        "value": "T+tCrEORj2ipWjPwZIEHxvJUw2qIEWILz6HITxrVEnw9kpnaGmp5a1YGAnKuQZC3Vp4LEmyq6RqkQCIh/C/pAg=="
      }
    ],
    "revoked": false,
    "createdAt": "2026-05-23T00:00:00Z"
  }
}
